id,name,description,unit_price,merchant_id,created_at,updated_at
1,Pencil,You can use it to write things,1000,5,2016-01-11 09:34:06 UTC,2016-01-11 09:34:06 UTC
2,Pen,You can use it to write things,1200,6,2016-01-11 09:34:06 UTC,2016-01-11 09:34:06 UTC
3,Marker,You can use it to write things,1200,7,2016-01-11 09:34:06 UTC,2016-01-11 09:34:06 UTC
4,Fountain Pen, You can write fancy things,2000,7,2016-01-11 09:34:06 UTC,2016-01-11 09:34:06 UTC
5,Super Expensive Gold Pen, You can write expensive things!,1000000,7,2016-01-11 09:34:06 UTC,2016-01-11 09:34:06 UTC
