id,name,description,unit_price,merchant_id,created_at,updated_at
1,Pencil,”You use it to write things with lead”,5,101, 2015-01-01 11:11:37 UTC, 2015-10-10 11:11:37 UTC
2,Pen,”You use it to write things with ink”,10,101, 2015-01-01 11:11:37 UTC, 2015-10-10 11:11:37 UTC
3,Basketball,"You use i to play basketball",20,102, 2015-01-01 11:11:37 UTC, 2015-10-10 11:11:37 UTC
4,Baseball,"You use it to play baseball",10,102, 2015-01-01 11:11:37 UTC, 2015-10-10 11:11:37 UTC
5,Backpack,"You use it to carry your things",40,103, 2015-01-01 11:11:37 UTC, 2015-10-10 11:11:37 UTC
